"id","profileName","text","date","title","rating","images","helpful","variant:"
"R1PL0L81RSSJD4","Ani V.","Está buena pero está muy cara aquí, en costco la encuentras a la mitad del precio.","Revisado en México el 23 de enero de 2026","Buena pero cara.","3.0 de 5 estrellas","","0",
"R2JWBYW5IK0NOF","Jorge","Muy buena arena, contiene muy bien el olor, no desprende tanto polvo y a mis gatos les gusta, vale la pena por el precio y rinde","Revisado en México el 22 de enero de 2026","Rendidora y buen olor","5.0 de 5 estrellas","","0",
"R3JPYOUBXSH22C","Jesus P","Esta arena es una garantía para que en tu casa no se note que hay un gato","Revisado en México el 20 de enero de 2026","Excelente","5.0 de 5 estrellas","","0",
"R26MNFF88IEN0V","Brenda Gómez","Arena de muy buena calidad, muy absorbente y con control de olores. Totalmente recomendable","Revisado en México el 13 de enero de 2026","Excelente calidad","5.0 de 5 estrellas","","0",
"R4I5JCGNKTY7W","FRANCISCO VELAZQUEZ","Muy bie","Revisado en México el 9 de enero de 2026","Exelente","5.0 de 5 estrellas","https://m.media-amazon.com/images/I/71JQueXh3UL.jpg","0",
"R23C9P7ZI5D5GJ","Guadalupe C.","Excelente","Revisado en México el 8 de enero de 2026","Excelente","5.0 de 5 estrellas","","0",
"R3HSG3UO1VLHW3","Yax Robles","Es un poco cara pero aglutina bien","Revisado en México el 4 de enero de 2026","Buen Precio-Calidad","4.0 de 5 estrellas","","0",
"R2TRSV3QW75F2E","Angie Serrato","La mejor arena pero exageradamente cara","Revisado en México el 3 de enero de 2026","Muy buena","5.0 de 5 estrellas","","0",
"R3RD694O49IV1C","Fernanda Contreras","Cumple, pero hay arenas que por un poco más mantiene mejor los olores","Revisado en México el 18 de diciembre de 2025","Buena pero hay mejores","3.0 de 5 estrellas","","0",
"R2PZ04EE7UNDIV","Brisa López","La mejor arena que he usado para mi gato, no huele mal, es fácil de limpiar y rinde mucho.","Revisado en México el 13 de diciembre de 2025","Muy buena.","5.0 de 5 estrellas","","0",
"R5UIU0XGACBAT","Geraldine Zúñiga","Llegó bien pero siento que esta arena que me llegó en esta ocasión suelta más polvo","Revisado en México el 25 de noviembre de 2025","Bueno pero suelta polvo","4.0 de 5 estrellas","","0",
"RO7LFZ2MGSNRZ","Samuel David Murguía Sarabia","Esta es la única arena que sí sirve","Revisado en México el 24 de noviembre de 2025","La mejor arena","5.0 de 5 estrellas","","0",
"R38KU8U00M11U8","Sara Fernandez","Muy buen producto, cumple con lo ofrecido, llegó antes de lo esperado.","Revisado en México el 5 de noviembre de 2025","Buen producto","5.0 de 5 estrellas","","0",
"R2ZXT3H71GMROT","Lupita Zuñiga","Excelente hace un mes que la pedí y no ha llegado por DHL LO ENVIARON pésimo servicio varias veces quedaron mal. Quiero devolverlo!!","Revisado en México el 2 de noviembre de 2025","Comprarla siempre, es garantía de sin olores!","5.0 de 5 estrellas","","0",
"R2NUOVCIC43MG","Lourdes Vázquez","La mejor arena para gatos","Revisado en México el 1 de noviembre de 2025","Arena para gatos","5.0 de 5 estrellas","","0",
"R3FUP6IIL92PW8","Luis M. BG","Buen precio para la arena y seca bien y guarda olores","Revisado en México el 22 de octubre de 2025","Bien para los gatos","5.0 de 5 estrellas","","0",
"R2BE3FNY98U37Z","Jose G.","Excelente producto","Revisado en México el 5 de octubre de 2025","La eficacia del producto","5.0 de 5 estrellas","","0",
"R3S42UHP91OG28","Omar Antonio Badillo Sánchez","No hay otra, es la mejor arena que existe","Revisado en México el 25 de septiembre de 2025","La mejor arena para gato","5.0 de 5 estrellas","","0",
"R46WQKUL59B2Q","Gloria Guerrero","Buena calidad, y elimina cualquier mal olor","Revisado en México el 5 de septiembre de 2025","Elimina totalmente el mal olor","5.0 de 5 estrellas","","0",
"R3QQJX7RX2KVIB","El equipo llegó en muy buen estado , funciona de manera correcta en todos los sentidos , la calidad del audio es muy buena y el equipo es muy fácil de usar y de configurar","Si tu eres de los que tiene arenero en el interior, déjame decirte que esta arena aglutina super bonito. No es apestosa y si limpias de manera constante es rendidora, honestamente es un poco mas cara pero vale realmente la pena y lo mejor seca bien rápido las eses de los animalejillos.","Revisado en México el 4 de septiembre de 2025","Arena de buena calidas","5.0 de 5 estrellas","","0",
"R13YDYRLZUIYKT","Erii Galindo","La mejor arena","Revisado en México el 13 de agosto de 2025","La mejor arena","5.0 de 5 estrellas","","0",
"R310ZKK82C7XN3","Els","Excelente marca, aglutina muy bien y atrapa olores.","Revisado en México el 2 de agosto de 2025","Excelente","5.0 de 5 estrellas","","0",
"R23GISCKCM0QHN","Valeria Martinez -Albarran","Buen precio, agradable aroma, dura bastante bien","Revisado en México el 30 de julio de 2025","Excelente arena","5.0 de 5 estrellas","","0",
"R3NB17GXA7WVUU","Rosa H.","Excelente producto","Revisado en México el 18 de julio de 2025","Excelente","5.0 de 5 estrellas","","0",
"R14C14UY5YWHUD","Maribel","Está arena para gatos es excelente!","Revisado en México el 13 de julio de 2025","Excelente arena!","5.0 de 5 estrellas","","0",
"RH6Q7Z2O5AOVO","Erwin Chiquete Anaya","La mejor arena para gatos que me he encontrado hasta el momento. Solo que está un poco cara.","Revisado en México el 8 de julio de 2025","Recomendada","4.0 de 5 estrellas","","0",
"R2LWRT0397JN5T","JIMGONCAR","Excelente producto","Revisado en México el 29 de junio de 2025","Excelente","5.0 de 5 estrellas","","0",
"R1ZKIGO20O1K4J","Lidia","Excelente!!! Es buenísima! Aglutina muy bien, se recoje los desechos fácil y dura más que las normales. Además la encontré en descuento.","Revisado en México el 29 de junio de 2025","Excelente!!!","5.0 de 5 estrellas","","0",
"R2OJL4YSR4GORN","Dulce Govea","La mejor arena que existe. He probado muchas, pero es la única que aglutina perfectamente, no guarda olores y dura muchísimo. Vale la pena invertir en esta arena.","Revisado en México el 25 de junio de 2025","La mejor del mercado","5.0 de 5 estrellas","","0",
"R2UNB5YCCNTGB4","Saul knight","Muy buena arena tu gato la amara, lástima que ya no tienen el mismo precio y pues la puedes conseguir en Costco en un precio más accesible.
Si no fuera por eso la seguiría comprando.","Revisado en México el 21 de junio de 2025","Tu gato la amara!","4.0 de 5 estrellas","","0",
"R3HD07COKRT0T6","Teresa","Aglutina muy bien los líquidos,,y protege de malos olores","Revisado en México el 15 de junio de 2025","Arena para gato","5.0 de 5 estrellas","","0",
"R3HSOEZU5MZIMJ","Edith Michel Zamora","es una arena muy buena , aglutina bastante bien, el perfume puede ser algo fuerte para algunos michis","Revisado en México el 14 de junio de 2025","Muy buena","5.0 de 5 estrellas","","0",
"R2MU28V0F5PG72","Abril Martinez","Me gusta mucho esta arena para mi gato. No deja olores y es súper duradera. Los 19kg me duraron como 2meses y medio /3 meses. Lo que la verdad no me encanta es que sí levanta mucho polvo a la hora de limpiarla y con el tiempo si la pala que tienes para limpiarla es muy ancha o hay mucho espacio entre las rejillas cuesta limpiar y no queda del todo limpia la arena.","Revisado en México el 12 de junio de 2025","Buena en general","4.0 de 5 estrellas","","0",
"R3DLSN3O6052Q3","DIANA GARCIA","Excelente arena, quita el olor inmediatamente, fácil de limpiar. Yo probé muchas arenas porque a mí gato no le gustan las de grumos grandes","Revisado en México el 8 de junio de 2025","Excelente","5.0 de 5 estrellas","","0",
"R1X978D6CUOI9L","Yosahadarath Ramos","Muy buena calidad pero la encuentras mas barata en Costco.","Revisado en México el 4 de junio de 2025","Buena","5.0 de 5 estrellas","","0",
"ROUDJBM2BP4CU","Guillermo Álvarez Labastida","Es mi marca preferida de arena para gato. Neutraliza olores, rinde bien y es la mejor relación calidad-precio.","Revisado en México el 24 de mayo de 2025","Económica y efectiva","5.0 de 5 estrellas","","0",
"R304DBDZXY6F96","Erika","Llevo varios años usando esta arena y nunca he tenido problemas. Ayuda a minimizar/neutralizar el mal olor, y se agluitina bastante bien.","Revisado en México el 20 de mayo de 2025","Buena compra","5.0 de 5 estrellas","","0",
"R2PFYGPZJQNREJ","elba oleaol","Me encanta esta arena porque encapsula la pis del gato y al gato le encanta. No le gusta otra arena.","Revisado en México el 18 de mayo de 2025","De las mejores arenas para gato","5.0 de 5 estrellas","","0",
"R11BYUNYL98I84","Rossy","Siempre he pedido está arena porque atrapa muy bien el mal olor y huele rico si arenero","Revisado en México el 14 de mayo de 2025","Buena arena","5.0 de 5 estrellas","","0",
"R117PJXTQDZC1H","Alexis Garduño Martínez","Excelente arena, me animé a comprarla para mi bebe, ayer la estreno, 0 polvo y 0 olores. Me agrado bastante!","Revisado en México el 14 de mayo de 2025","ARENA EXCELENTE","5.0 de 5 estrellas","","0",
"R1U4G3WVP2LTMJ","Valeria Juárez M","Justo lo que necesitaba","Revisado en México el 13 de mayo de 2025","Lo necesito","5.0 de 5 estrellas","","0",
"RBJOBHKHEWKD1","Lourdes Nieto Aguilar","Excelente producto","Revisado en México el 9 de mayo de 2025","Producto de la excelente calidad","5.0 de 5 estrellas","","0",
"RQWIR2EPZQ5HF","TePi","Muy buena arena. Huele bien, se aglutina correctamente, no es ni fina ni gruesa, fácil de limpiar. A mis gatos les encanta. Lo único malo es que es demasiado cara.","Revisado en México el 7 de mayo de 2025","Buen producto pero caro","4.0 de 5 estrellas","","0",
"R9PAGKHGQJZBT","Paulina provincia","Excelente producto, huele rico siempre y no se desperdicia la arena ya que se hace bolita la pipí y sólo hay que levantar ese pedacito. Es la mejor arena que hemos comprado !","Revisado en México el 2 de mayo de 2025","Excelente calidad","5.0 de 5 estrellas","","0",
"R1NX0702TROWNK","Karen Flores","Es buena pero si los gatos hacen donde no hay arena y posterior realizan a taparla ya no aglutina y se hacen grumos y es difícil de recoger con la pala se quedan muy pegados al arenero 😔","Revisado en México el 30 de abril de 2025","Más o menos","3.0 de 5 estrellas","","0",
"RKFPC4MMNUMQX","Sayda S.","Muy buen producto. Llegó antes de lo esperado.","Revisado en México el 22 de abril de 2025","Arena para Gato ScoopAway","5.0 de 5 estrellas","","0",
"R3MQ76697WE48R","ZackXamu","Excelente de lo mejor, he probado todas, estas es la mejor...","Revisado en México el 18 de abril de 2025","LA MEJOR DE TODAS","5.0 de 5 estrellas","","0",
"R2GOE64KDBBPGQ","Gloria Serrano","La mejor arena del mercado","Revisado en México el 28 de marzo de 2025","La mejor","5.0 de 5 estrellas","","0",
"R1GE2RSC4HIDCH","Kathy V.","Recomendable","Revisado en México el 3 de marzo de 2025","Recomendable","5.0 de 5 estrellas","","0",
"R2VFXDO7I87HFI","Clienta de Kindle","Funciona excelente! Si tiene algo de polvo pero controla perfecto los olores. Sin duda esta será mi arena de cabecera!","Revisado en México el 26 de febrero de 2025","Excelente","5.0 de 5 estrellas","","0",
"RMPR4JQ0RVV7E","Josselyn Ileana","Mi marca favorita de arena para gato, no suelta polvo y aglutina bien. Recomendable","Revisado en México el 11 de febrero de 2025","Muy buena","5.0 de 5 estrellas","","0",
"R1L26A6Y6F83OQ","Cliente de Amazon","Es muy buena arena, pero abusan de los precios! no tiene ni un año que la estoy comprando y ya subio 30% de lo que costaba. Me temo que buscaré alternativas ya que por lo que se ve seguira subiendo mucho más exageradamente.","Revisado en México el 11 de febrero de 2025","Buena Arena pero precio excesivo y a la alza","2.0 de 5 estrellas","","0",
"RJ94X2FVWN6D1","Betsabe Mata","Funciona y llegó bien, pero prefiero otras marcas","Revisado en México el 5 de febrero de 2025","No es mi marca favorita","5.0 de 5 estrellas","","0",
"R1MQU7H56UMEF1","Fernanda G","Excelente calidad. Aglutina muy bien y deja un aroma agradable.","Revisado en México el 30 de enero de 2025","Excelente producto","5.0 de 5 estrellas","","0",
"RNSTYL31PZZSB","ROSARIO ARIZAGA","He comprado infinidad de marcas diferente y siempre regreso a esta, es buenísima para aglutinar y absorber olores, mis gatos la aman.","Revisado en México el 19 de enero de 2025","Excelente producto","5.0 de 5 estrellas","","0",
"R1490QVRTXM8SR","HORRIBLE","La peor arena que le he comprado a mis michis, la pedí porque en Internet tenía muy buenas reseñas y según que era de las mejores, pero saca polvo a montones, tenía que lavar su arenero más seguido porque no aglutina bien, y para lo que cuesta realmente no vale la pena, si olía la casa apesar de que la limpiaba dos veces al día, tengo dos gatos medianos y me ha servido mejor la arena Bob premium del walmart. Esta no se las recomiendo","Revisado en México el 16 de enero de 2025","Horrible","1.0 de 5 estrellas","","0",
"RQVJ0CLV1A8OT","FRANCISCO MORALES FLORES","huele bien","Revisado en México el 4 de enero de 2025","que huele bien","5.0 de 5 estrellas","","0",
"R3TLFSBKOV4RNW","Daniela","Esta es la mejor arena para gato que he probado, intentamos con varias, desde las más económicas hasta las más caras, definitivamente esta es la mejor opción","Revisado en México el 1 de enero de 2025","La mejor arena","5.0 de 5 estrellas","","0",
"R3DQT3KP1LDEYL","Itzel G.","Me gusta el olor de la arena, y a mi gatita también le ayuda para identificar su arenero.","Revisado en México el 31 de diciembre de 2024","Buenisima","5.0 de 5 estrellas","","0",
"R2VDWFJEK39THV","Marisol Garza","Mis gatitas llevan una semana usando el producto y, hasta ahora, estoy bastante satisfecha con el rendimiento, la capacidad de aglutinado y el bloqueo de olores. Aunque es un poco cara comparada con otras arenas, creo que vale la pena comprar esta marca con este proveedor. Sin duda, volveré a adquirirla.","Revisado en México el 23 de diciembre de 2024","Excelente relación calidad-precio","5.0 de 5 estrellas","","0",
"RYL1K0UPNWKWF","Oly","Todo llego en tiempo y con la calidad que esperaba","Revisado en México el 22 de diciembre de 2024","Muy bien","5.0 de 5 estrellas","","0",
"RKQXF3ESKTCTC","Jesus Medina","genera un poco de polvo al manipularla pero funciona y aromatiza muy bien","Revisado en México el 17 de diciembre de 2024","buena","5.0 de 5 estrellas","","0",
"R12WKIHIN907CF","Alex Go","La arena huele bien (parecido al detergente para ropa), neutraliza los aromas, encapsula perfectamente el orín y las heces.","Revisado en México el 11 de diciembre de 2024","La mejor arena para gato que he comprado hasta el momento","5.0 de 5 estrellas","","0",
"RW4LT9RP3N7H0","Lilivet","Esta arena es lo máximo en verdad. Cumple con todo, no se apesta, es muy fácil limpiar, aglomera súper bien, ninguna como esta arena y he probado muchísimas.","Revisado en México el 9 de diciembre de 2024","Lo máximo","5.0 de 5 estrellas","","0",
"R33RO1FR16VVO","Anell gonzalez medina","Es un producto que ya use en el pasado así que sé que llenará mis espectativas","Revisado en México el 6 de diciembre de 2024","Excelente producto","5.0 de 5 estrellas","","0",
"R1LZGRDYRNMRTI","Mab","La arena es fina por lo que absorbe bien todo, es fácil de limpiar y no se queda en las patitas de tu gato.","Revisado en México el 4 de diciembre de 2024","Buen producto","5.0 de 5 estrellas","","0",
"R2IBYHJ9LSPPQS","Buenos guantes, para lo que son, cómodos y fácil de limpiar","Tener en cuenta tengo 5 gatos, por lo que si tienes 2 podrían servir bastante bien, ya tener más de eso la arena no dura absolutamente nada","Revisado en México el 3 de diciembre de 2024","Me decepciono","2.0 de 5 estrellas","","0",
"R28NC122PVWX6H","Rosazul C.","He probada varias marcas pero esta es la mejor. Aglutina muy bien, los terrones no se deshacen y controla el olor.
La recomiendo ampliamente","Revisado en México el 2 de diciembre de 2024","Es la mejor arena","5.0 de 5 estrellas","","0",
"R1DO1BZ2OUF8ZV","Rosa Patricia de Paz de Grau","Gracias! Me encanta Amazon! Me siento muy segura comprando por Amazon.","Revisado en México el 28 de noviembre de 2024","Arena para Gato Scoop Away, La Mejor!","5.0 de 5 estrellas","","0",
"R3KNYMZDP2BH49","Lorenzo Castaneda","Servicio rápido y producto que mantiene su calidad.","Revisado en México el 28 de noviembre de 2024","Gato feliz!.","5.0 de 5 estrellas","","0",
"R31N77YUBXBKQO","Lety","Esta arena de gato es buena aglutina bien y tiene un buen aroma, estoy satisfecha con mi compra","Revisado en México el 28 de noviembre de 2024","Aglutina bien y tiene buen olor","5.0 de 5 estrellas","","0",
"RZY62S52BUGTF","GABRIELA LOZANO MEDINA","La arena es muy buena, perfectamente aglutinante","Revisado en México el 24 de noviembre de 2024","Super compra","5.0 de 5 estrellas","","0",
"R22Y1MF0L017RP","Francisco Espinoza Alonso","Muy buen producto, mitiga bien los olores y dura mucho a pesar de tener dos gatos, muy recomendable.","Revisado en México el 19 de noviembre de 2024","Buen producto","5.0 de 5 estrellas","","0",
"R17ZZB3QXCU02K","Keny","Es difícil encontrar una arena más teniendo 2 gatos ,con esto dura un mes y no se atasca ni queda impregnado","Revisado en México el 18 de noviembre de 2024","Mis gatos les gusta","5.0 de 5 estrellas","","0",
"R22O5UWMF9B2OF","Susy Hop","Le gusta al gato y evita malos olores.","Revisado en México el 17 de noviembre de 2024","Excelente producto.","5.0 de 5 estrellas","","0",
"R2WRDIIMHL2LXP","Juan Antonio Carlos Rodriguez","Gran calidad de arena","Revisado en México el 17 de noviembre de 2024","Buena compra","5.0 de 5 estrellas","","0",
"R2ULA8XWXDDJOG","Ines","Aglutinan muy bien pero suelta demasiado polvo y se le pega a sus patitas la arena y queda por toda la casa. A mi me gusta estar descalsa en la casa y ando pisando arenitas todo el tiempo.","Revisado en México el 16 de noviembre de 2024","Muy polvoso","3.0 de 5 estrellas","","0",
"R31DUNR60PEKS3","Hatysa","Es muy buena arena, no tiene nada de polvo, el único problema es que su efecto aglutinante hace que se haga una roca que muchas veces se pega al arenero y dificulta la limpieza al doble... también he visto como se pega bastante al pelaje de mis gatos. Supongo que que eso de ""mantenerlo al nivel"" es muy estricto, pero por el precio es un poco dificil con 3 gatos... Sin embargo, lo compro cada que lo veo en oferta","Revisado en México el 16 de noviembre de 2024","No tan perfecto...","4.0 de 5 estrellas","","0",
"R3SNLZHC0W61WI","Melissa","Es buena, pero el olor no es de mi agrado. El precio es bueno y rinde mucho.","Revisado en México el 16 de noviembre de 2024","Buena opción","4.0 de 5 estrellas","","0",
"R3QKQTG6ID9ZMG","Itzel M.","La verdad es que aglutina muy bien 👌🏼
No huele mal, la verdad es que ha subido mucho de precio pero considero que si vale la pena, prefiero esta que cualquiera del súper que se deshacen los terrones de pipí y se apesta horrible el arenero 10/10","Revisado en México el 13 de noviembre de 2024","Aglutina muy bien","5.0 de 5 estrellas","","0",
"R30U9JZRZ6P3ZH","Pilar Carrillo","Es el que uso siempre. Lo he pedido muchísimas veces.","Revisado en México el 12 de noviembre de 2024","Funciona","5.0 de 5 estrellas","","0",
"R3MAW7QDIM66FF","Cliente de Amazon","Está arena siempre la hemos usado para la tina de nuestros gatos, excelente producto","Revisado en México el 11 de noviembre de 2024","Gato feliz","5.0 de 5 estrellas","","0",
"R26ORAVUJZ73P0","Maria De Los Angeles Ayon Molina","Este producto es fantástico para los que tenemos mascotas gatunos, no tiene olor, sumamente tolerable por los felinos, estoy encantada","Revisado en México el 10 de noviembre de 2024","Mascota gatuno","5.0 de 5 estrellas","","0",
"R14NKT6E9TNDI8","MELINA G.","Es la mejor arena.","Revisado en México el 9 de noviembre de 2024","Es la mejor","5.0 de 5 estrellas","","0",
"R3IHYW6X76NCHR","Alejandro M.","Funcional al 100%","Revisado en México el 8 de noviembre de 2024","Siempre buena","5.0 de 5 estrellas","","0",
"R2REFRHWJDOOTL","Cliente de Amazon","Genera mucho polvo y no soporta los orines de mis gatos, ya que no se conserva de manera solida, representaba un gasto muy fuerte estar cambiando constantemente esta arena. cambie por otra marca de tipo pallets o tofu, no la recomiendo.","Revisado en México el 7 de noviembre de 2024","horrible y cara","1.0 de 5 estrellas","","0",
"RUWSVLMJZ2CZ8","Ethel R.","Es la arena que siempre le compro a mis gatos. Dura bastante, contiene muy bien los malos olores y mis gatos se sienten cómodos usándola. He probado varias otras, pero esta es la que mejor ha funcionado.","Revisado en México el 3 de noviembre de 2024","La arena preferida de mis gatos","5.0 de 5 estrellas","","0",
"R1O7YJDIJ3644O","Rosa Maria Gutierrez Rios","Buen producto","Revisado en México el 1 de noviembre de 2024","Genial producto el vendedor siempre muy puntual en sus entregas","5.0 de 5 estrellas","","0",
"R23MOIWNVUWY0B","Adrian Saenz","Muy buena","Revisado en México el 26 de octubre de 2024","Buena","5.0 de 5 estrellas","","0",
"R2WSY543LVPWKV","alissalas","Buen producto!","Revisado en México el 26 de octubre de 2024","Calidad","5.0 de 5 estrellas","","0",
"R2P8YQ546P5QZQ","Excelente producto mi gato lo ama, solo escucha el sobre y corre para devorarlo","Super recomendado, absorbe bien los olores de popó y pis de mi gato","Revisado en México el 24 de octubre de 2024","Recomendamos","5.0 de 5 estrellas","","0",
"RPJPJT5B856QB","Andy","Tengo dos gatos que usan cuatro areneros, y esta arena nos ha durado más de dos meses! Funciona super, lo único es que suelta bastante polvo, pero luego de ver lo mucho que rinde, no la cambiaría.","Revisado en México el 20 de octubre de 2024","Super duradera","5.0 de 5 estrellas","","0",
"RD9GUTYE80VMA","Erick Joan Ordaz Muciño","El precio vale totalmente la pena. Elimina a la perfección los olores y las piedras de pipí no se desmoronan para nada, las deja super firmes, por lo que no se tiene que cambiar la arena. Recomiendo ampliamente.","Revisado en México el 19 de octubre de 2024","Aglutina perfectamente","5.0 de 5 estrellas","","0",
"R34LVTWIC8MQ9O","Casi no saca polvo, aglutina muy buen y gasto menos arena","Tal vez sea un poco cara, pero casi no desperdicio arena, aglutina muy bien, no saca tanto polvo como otras y no genera malos olores","Revisado en México el 18 de octubre de 2024","Calidad","5.0 de 5 estrellas","","0",
"R34QH3MOXGV4UK","Cynthia Corral","Me gusta mucho el producto, lástima que haya tardado tanto en llegar","Revisado en México el 18 de octubre de 2024","Buen producto","5.0 de 5 estrellas","","0",
"R3V79J14AKFOBF","Hernández YJ","La mejor arena que he comprado","Revisado en México el 17 de octubre de 2024","Muy buena","5.0 de 5 estrellas","","0",
"R15DEWFDABBG4B","Sandra","Es excelente, y es de las pocas arenas que me gusta mucho y no guarda olores","Revisado en México el 14 de octubre de 2024","Amo esta arena","5.0 de 5 estrellas","","0",
"R1GTIQP6K1O90I","miguel guerrero sámano","Si se limpia constantemente y se cambia por completo como lo indican, no hay olores en la casa.","Revisado en México el 11 de octubre de 2024","Muy buena opción","5.0 de 5 estrellas","","0",
"RMMGBO0FO4GB2","clau uribe","Muy buena","Revisado en México el 6 de octubre de 2024","Muy buena","5.0 de 5 estrellas","","0",
"R2E81VFTW3BKN2","Mig Bobadilla","Lo que no me gusta es que tarda demasiado en llegar la arena la pedí desde el 30 de septiembre y se supone que debió llegarme el 3 de octubre y resulta que hasta el 19 de octubre me va a llegar 🙄","Revisado en México el 5 de octubre de 2024","La calidad de la arena es excelente","5.0 de 5 estrellas","","0",