"id","profileName","text","date","title","rating","images","helpful","variant:tamaño","variant:"
"R3R9PF7RGF5MCA","Carrie McCain","I have five cats, so there's a lot of litter here. I find Arm & Hammer to be much better than other similar brands. The clump and seal platinum is a couple more dollars than the regular, but it scoops easily, and doesn't fall apart when there's a clump. The scent is very light, yet keeps oders in check. I used this brand and type for a few years.","Revisado en los Estados Unidos el 7 de diciembre de 2025","Best litter!","5.0 de 5 estrellas","","0","37lb – Frustration Free Pack",
"R13DHDEY66QYHN","Michael Gafan","Coool but expensive.","Revisado en los Estados Unidos el 6 de diciembre de 2025","Clamping is awesome","5.0 de 5 estrellas","","0","37lb – Frustration Free Pack",
"R1NB20TN8GVWDD","JlHDallas","This is the best litter we’ve tried for our cats. Clumps really well and absolutely no odor for almost 2 weeks. The key is keeping the litter several inches deep!","Revisado en los Estados Unidos el 4 de diciembre de 2025","Clumps well, no stink","5.0 de 5 estrellas","","0","37lb – Frustration Free Pack",
"R3DYCW91QW27OZ","Darin K.","If you have a litter robot don’t use. Wastes arm and hammer litter","Revisado en los Estados Unidos el 3 de diciembre de 2025","Don’t use if you have a litter robot","2.0 de 5 estrellas","","0","37lb – Frustration Free Pack",
"R3SQW138ORP5WR","Andrew","Delivery was excellent … But the litter box looks like it went through a car accident!!!!!!","Revisado en los Estados Unidos el 1 de diciembre de 2025","Cat parent","1.0 de 5 estrellas","","0","27.5 lb",
"R2NZ8RCLJ1EQL0","Berenika Mocarski","I’ve tried a lot of cat litters, but the Arm & Hammer Clump & Seal Platinum is by far the best. It’s 100% worth the money — I’m never switching to anything else. The litter keeps odors completely under control; my house doesn’t smell like cat waste at all, even after a few days.

I love the fine sand texture — not rocks — which makes it comfortable for my cats, easy to scoop, and keeps the clumps tight so it lasts longer. It really covers waste perfectly. Plus, it doesn’t track or stick to paws, so my floors stay clean.

Overall, it’s clean, odor-free, and my cats actually seem to prefer it. If you want a litter that works as advertised and makes your life easier, this is it.

Definitely get this on subscription since it’s an online exclusive and you don’t wanna be without it!!!","Revisado en los Estados Unidos el 30 de noviembre de 2025","Best Cat Litter EVER! Totally Worth It","5.0 de 5 estrellas","https://images-na.ssl-images-amazon.com/images/G/01/x-locale/common/grey-pixel.gif
https://images-na.ssl-images-amazon.com/images/G/01/x-locale/common/grey-pixel.gif","0","37lb – Frustration Free Pack",
"R2K7653NEAKDLT","Pro","The go-to litter for my Litter Robot 4. It is low dust and great clumping. The cats do not track it much either. I have pet mat spread out in the cat room in front of the litter robot and the litter does not track to other areas of the house. It has made our life so much easier in a multi-cat household. The box is also very well designed which makes opening and pouring the litter very convenient.","Revisado en los Estados Unidos el 29 de noviembre de 2025","Great litter for the Litter Robot 4","5.0 de 5 estrellas","","0","27.5 lb",
"RSRSDPHK07WZN","Sinny","When I poured it into the litter box, a lot of dusts came out. I don’t like dusty litter since it will stick to my cat’s feet.","Revisado en los Estados Unidos el 27 de noviembre de 2025","Good value, but","3.0 de 5 estrellas","","0","37lb – Frustration Free Pack",
"RAC2O356O7QJ9","Dawn W.","Clumps well but has a very weird, unpleasant odor from the deodorant as it gets mixed with cat urine no matter how clean you keep the litter box.","Revisado en los Estados Unidos el 25 de noviembre de 2025","Unpleasant smell","2.0 de 5 estrellas","","0","27.5 lb",
"R3O0VW2HUY92QZ","Amazon Customer","Made my cats very sick and had two of them vomiting repeatedly within a day of use. Never again.","Revisado en los Estados Unidos el 19 de noviembre de 2025","Made cats sick","1.0 de 5 estrellas","","0","37lb – Frustration Free Pack",
"RH3O9XMDITQH","nijimon","makes clump that are easy to scoop. A little on the expensive side","Revisado en los Estados Unidos el 18 de noviembre de 2025","clumps are easy to scoop","5.0 de 5 estrellas","","0","37lb – Frustration Free Pack",
"RM5XVGK5ZKWW7","Matt Conlon","I've been through many different brands of litter, and this is by far the greatest. It's not powdery; it keeps the stink contained well, clumps, and doesn't cause cats to leave prints ont he floor.","Revisado en los Estados Unidos el 14 de noviembre de 2025","Multiple cats, zero problems","5.0 de 5 estrellas","","0","37lb – Frustration Free Pack",
"R241CWIRHJE42J","pauls kindle","I like this kitty litter. It works very well. Low dust. No tracking. And it clumps very well. My cats seem to like it. It has a very good odor control. I never smell cat waste.","Revisado en los Estados Unidos el 12 de noviembre de 2025","This is on reorder","5.0 de 5 estrellas","","0","37lb – Frustration Free Pack",
"R1RAHQ1L0JJBCM","THall","I decided to bite the bullet and go for the expensive stuff because I’m sick of the smell!!! This stuff clumps good but does absolutely nothing for the odor. So disappointed.","Revisado en los Estados Unidos el 11 de noviembre de 2025","Does","2.0 de 5 estrellas","","0","37lb – Frustration Free Pack",
"RZST86J1N9V5W","Elena","What a great stuff! I am a first-time cat mama, and have been trying multiple products, and this one made a huge difference in looking after the litter box. Definitely recommend","Revisado en Canadá el 9 de noviembre de 2025","VERY IMPRESSIVE!","5.0 de 5 estrellas","","0","27.5 lb",
"R1H482QZL0QH44","Isabelle","Great litter! Highly recommend if you have multiple cats!","Revisado en los Estados Unidos el 7 de noviembre de 2025","Highly recommend","5.0 de 5 estrellas","","0","27.5 lb",
"RMCSXX0RK008N","Amazon Customer","Great product. Excellent absorption and odor control. Would definitely recommend.","Revisado en los Estados Unidos el 4 de noviembre de 2025","Smell B Gone!","5.0 de 5 estrellas","","0","37lb – Frustration Free Pack",
"RCTCJBE22KDT8","Connie","I think this cat litter is very effective in that it eliminates odors and clumps very well. However, after doing some research on this cat litter, this is what I have found. Yes, ARM & HAMMER Clump & Seal Platinum Cat Litter contains several chemicals, including preservatives, fragrance, and process aids. The ingredient list includes sodium bicarbonate (baking soda) for deodorization.
Other ingredients include C15-30 hydrotreated alkanes and C20-50 hydrotreated alkanes, which are used as process aids. The general risks associated with cat litter ingestion or exposure when cats clean themselves include:
Intestinal obstruction if large amounts of litter are ingested, especially crystalline types.
Gastrointestinal upset, such as vomiting or constipation, from ingestion of any litter type.
Respiratory irritation in sensitive cats, particularly from scented or dusty litters.
Allergic reactions, including paw swelling or skin lesions, to certain litter materials.
The litter also contains preservatives such as benzisothiazolinone and methylisothiazolone, which are known to prevent microbial growth.
Additionally, fragrance is included to provide a scent, and C12-15 alcohols ethoxylated is used as an absorbent aid.
The product also features a proprietary adhering ingredient that helps form hard clumps by binding particles to feces. This is probably why the cat litter smells like plastics.
While the main ingredients are derived from mineral and plant sources, the inclusion of synthetic additives like preservatives and fragrance indicates the presence of chemicals beyond natural components. You decide if this litter is safe for your cat.","Revisado en los Estados Unidos el 28 de octubre de 2025","May not be good for your cat!","2.0 de 5 estrellas","","0","37lb – Frustration Free Pack",
"R3EFLC1LARVF53","David Hiley","As expected","Revisado en los Estados Unidos el 23 de octubre de 2025","As expected","5.0 de 5 estrellas","","0","37lb – Frustration Free Pack",
"R33TMWMJ0IBMA9","Julie","I wish I could get this more easily in Australia. It’s a great product.","Revisado en Australia el 23 de octubre de 2025","Clean and neat clumps","5.0 de 5 estrellas","","0","8.61 kg",