"id","profileName","text","date","title","rating","images","helpful","variant:"
"RTER4RSBE2RLU","Sharlie","Works like a charm, literally zero dust, no obnoxious perfume, excellent clumping. Litter is light enough in colour to notice if anything is wrong with your cat. I wouldn’t hesitate to recommend this kitty litter. (I do scoop twice daily so that may make a difference)","Revisado en Canadá el 30 de septiembre de 2025","No dust. No smell. Great clumping.","5.0 de 5 estrellas","","0",
"R10WXCC7YJGF8M","Michael","Good clumping, almost completely dust free, good texture. The only negative thing is the smell. It's just off and unpleasant. We would especially smell it every time the litter robot would cycle. We initially thought that we were smelling the waste but it was the sand itself. Otherwise, the value for money is great, box was packaged well and arrived in great condition.","Revisado en los Estados Unidos el 28 de septiembre de 2025","Good product, odd smell.","4.0 de 5 estrellas","","0",
"R35P3RA1KCMVZS","Christine DiBiaso","Great clumping and nice fragrance","Revisado en los Estados Unidos el 28 de septiembre de 2025","Good clump","5.0 de 5 estrellas","","0",
"R2J41DF2CYVUS6","Kathleen L.","My cats like it better than cats pride litter. The only complaint I have is the perfume smell is strong for me. It does fade. I was going to have it delivered every month but found I can get it for $4 less at hanafords.","Revisado en los Estados Unidos el 23 de septiembre de 2025","Ok litter","4.0 de 5 estrellas","","0",
"R1XUY5Z2FH1YOZ","SKF","Nice product. No dust. It's $4 cheaper at my local grocery store.","Revisado en los Estados Unidos el 22 de septiembre de 2025","Cheaper locally","5.0 de 5 estrellas","","0",
"R3NFPYRS75YEMV","M MADSON","This litter kicks up absolutely NO dust at all! Not when you pour it in the box and not when you scoop the box. The litter I normally use sends up clouds of dust anytime the litter is disturbed, including when the cats are digging around in it. The area around the large box I have constantly needs dusting and sweeping.

It doesn't seem to be tracking outside of the box either. My boxes are actually large sterilite plastic tubs, I have huge cats and they don't fit in most boxes, so they have to literally jump out of the box. Even though I have rugs around them to catch stray litter, they still manege to track litter all over. Since I started using this litter, the tracking is nominal. The clumps are fairly hard and don't break up when scooping, so it scoops clean. There is no apparent odor to it, and my cats didn't seem to notice the change in the litter.

I live in a household with multiple cats using the boxes and even though I scoop twice daily, as the litter ages, the odor starts to come out. I will update the review once I can tell if that's not as bad either, but for now, I'd recommend this to anyone looking for a quality litter. I even sent some to a friend who is highly allergic to dust and she hasn't indicated any problems with it.","Revisado en los Estados Unidos el 22 de septiembre de 2025","Dust free perfection!","5.0 de 5 estrellas","","0",
"R3MY98BDUL3QBW","Jenny Q.","First, when I purchased the liter I was expecting a bigger box and more durable container. The litter is very sand like an is durable but it does get stuck to there paws and makes a mess. So it does track everywhere. No moisture. Nothing to say about the fit. I would say the durability is a 4 out of 10.","Revisado en los Estados Unidos el 21 de septiembre de 2025","Cat litter","3.0 de 5 estrellas","","0",
"R2BO3W0QP2GIAY","Janice M.","After my cat had some urinary tract issues, I made the switch to the cloud-free/control formula—and it’s been smooth sailing ever since. No flare-ups, no drama, just a happy kitty and a relieved human. Bonus points for the 18lb box option: it’s the perfect size—not so heavy that you feel like you're training for a strongman competition, but still enough to last a while.

I even send this litter to my elderly father for his cat, and he can handle the box without needing a forklift or a pep talk. It’s a win-win: good for the cats, easy on the humans, and no mysterious clouds of dust floating around like a haunted litter box.","Revisado en los Estados Unidos el 21 de septiembre de 2025","Cloud-Free and Worry-Free","5.0 de 5 estrellas","","0",
"R32LEHQ5QSO0MZ","John B. Lankford","Good product. Poor packaging. Whoever loaded the item punched a large hole in the box and litter spilled all over the inside of the box. Packing department needs to be more careful. I lost about 1/4 of the litter from the item.","Revisado en los Estados Unidos el 19 de septiembre de 2025","Good liter. Careless packer of item.","3.0 de 5 estrellas","","0",
"R10HV6FAX6E4QA","Amazon Customer","No dust in house front this product","Revisado en los Estados Unidos el 19 de septiembre de 2025","Is there dust with this product","5.0 de 5 estrellas","","0",
"R1ZCFMSGNNO089","Tracy Molyneux","Seller was great. Cat litter was worst kind I ever got, and smelled weird","Revisado en los Estados Unidos el 11 de septiembre de 2025","Seller good cat litter horrible","1.0 de 5 estrellas","","0",
"R2BJ4R5JFRLV8E","Zack","Not for me. Bought this for our three month old kittens and was not impressed. It did not mask the smell, was small-grained enough to be spread around the house and didn't smell great on its own, even without the waste. Switched to Purina tidy cats and that has worked much better for our kittens.","Revisado en los Estados Unidos el 10 de septiembre de 2025","Did not contain smell","2.0 de 5 estrellas","","0",
"R2EPQVRNYC79M2","Katrina","Clumps tightly and keeps the box fresh. My cats took to it right away, and cleanup is simple.","Revisado en los Estados Unidos el 6 de septiembre de 2025","Goodbye litter dust","5.0 de 5 estrellas","","0",
"R30QU0CN044PA9","Matthew","I was just starting to transition my cat onto this litter, and after the mix was 25% this and 75% Arm and Hammer Platinum SLIDE, when the urine rocks became as sticky as chewing gum. Since I have an automatic litter box, this created numerous disgusting messes that resulted from the sticky rocks rolling around in the box, and even ejecting outside it (and getting gobbled up by my robot vacuum). It's been impossible to clean out of the litter mats I've been using, and to top it off, this litter has absolutely no odor control.

Okay, but sure, there's less dust.

Things got better after I switched back to SLIDE. I now have a whole box of this stuff left, so I wasted my money.","Revisado en los Estados Unidos el 3 de septiembre de 2025","Stickiest litter I've ever seen","1.0 de 5 estrellas","","0",
"R2L557E346P49","gary beruck","Excellent e. Ontime","Revisado en los Estados Unidos el 28 de agosto de 2025","With care","5.0 de 5 estrellas","","0",
"R1PCMYNECD5K07","Santi13","I honestly don’t think I’ve ever been so excited to write a raving review in my life! This litter is legit. Let me begin by saying; we are a 3 kitty family. So, anywhere we can save when it comes to animal cost is major, because of that we have been purchasing a brand name litter from Costco for years now. The litter box is kept in the laundry room and my kids are usually on litter duty so I never really noticed an issue, with the exception of dust build up. Recently, I took over scooping, and oh my good gracious, the amount of dust cloud that came from that old litter was enough to give you an allergy attack. Not to mention, the increasing amount of litter dust throughout my laundry room. GROSS!
Anyways, I decided I had enough and looked into an alternative option. That’s when I found this Cloud control litter by arm & hammer. I am in absolute awe of this litter and its lack of dust or cloudy aftermath! Like, literal shock and so mad at myself for not buying it sooner. The litter itself is more of a sand like texture, so a bit lighter than other litters. It seems to clump well, and scoop easily. Although because of the texture, it does track a bit more than our old one. No biggie if you have a litter mat! The smell is a nice clean fresh scent, but not overwhelming or artificial smelling. I honestly don’t know if the 14 day claim on this litter is accurate, because I just started using it and I was too darn excited about the product that I just had to stop and write this review. I also immediately ordered another box to have as backup and now have this litter on my subscription. It’s is a bit more on the pricey side, but I would say the value of this litter is 100 percent worth a bit more cost.","Revisado en los Estados Unidos el 27 de agosto de 2025","Cloud Control is on Point!","5.0 de 5 estrellas","","0",
"RRIX5N78D17EQ","melissa noblin","Clumps perfectly, controls odor, and low dust. Makes cleaning the litter box so much easier. 5 stars!","Revisado en los Estados Unidos el 16 de agosto de 2025","Strong clumps, fresh box","5.0 de 5 estrellas","","0",
"R2T3TPEQTB6D47","Erika","This is my favorite litter. I have 2 cats and it really keeps a fresh scent for days. It also clumps very well.","Revisado en los Estados Unidos el 14 de agosto de 2025","Best litter","5.0 de 5 estrellas","https://images-na.ssl-images-amazon.com/images/G/01/x-locale/common/grey-pixel.gif","0",
"R2GGK6T9MB1ACZ","Trevor Hochkins","While my cat loves the sand quality the odor it comes with is so strong it gives me a headache. I don’t recommend for anyone with odor sensitivity.","Revisado en los Estados Unidos el 12 de agosto de 2025","Great litter but terrible smell.","3.0 de 5 estrellas","","0",
"R2OKLOI2QN8SJW","Barbara Smith","Love it!!! I just wish I could get this size box locally.","Revisado en los Estados Unidos el 9 de agosto de 2025","No dust!","5.0 de 5 estrellas","","0",
"R1E4T37O9DU97I","Rebecca Hayes","Super good oder control. Easy clean up. Cats like it. Highly recommend. I have 3 litter boxes in the house and my company swear they can't smell cat. A+","Revisado en los Estados Unidos el 4 de agosto de 2025","Great Oder Control","5.0 de 5 estrellas","","0",
"R3MJPWKH17F6H5","Stephanie","Love that this cat litter isn’t dusty whatsoever.","Revisado en Canadá el 31 de julio de 2025","True to its name","5.0 de 5 estrellas","","0",
"R24S1Q63RR4LYM","Robin","I like this litter doesn't leave dust everywhere","Revisado en Canadá el 30 de julio de 2025","Good stuff","5.0 de 5 estrellas","","0",
"R291N0VAJC0O6Q","Gail","No different then any other 99% dust free litter.","Revisado en los Estados Unidos el 29 de julio de 2025","Expensive","3.0 de 5 estrellas","","0",
"R29HCOCKKK60A5","Terri W","I think the one thing I most appreciate about this litter is there is no dust when scooping to clean the litter box. It also seems to keep odor down. The litter box is in a small space and I don't sense urine odor which makes me happy.","Revisado en los Estados Unidos el 29 de julio de 2025","Really great product","5.0 de 5 estrellas","","0",
"R35PE6FPGMRQVD","Amazon Customer","This was the best, as far as clumping. All the ones I use, this was the only one that had great clumping, which means easier clean up. Wish it came in larger size .","Revisado en los Estados Unidos el 27 de julio de 2025","The best clumping, easier clean up","5.0 de 5 estrellas","","0",
"RE9YFNIYPYP9I","Dianna Trombino Mestman","works fine... wish it had a little stronger scent to it ...","Revisado en los Estados Unidos el 24 de julio de 2025","no complaints... just the scent could be a little stronger","5.0 de 5 estrellas","","0",
"RX6VVF090PPX3","Sharon Stevens","I love this litter. Hardly any dust. Previous litters were causing my cat to wheeze and sneeze.","Revisado en Canadá el 9 de julio de 2025","no dust!!","5.0 de 5 estrellas","","0",
"R32UQQU3CEW20T","Tannya L. Wilson","It doesn't cover odor!
Doesn't match the good reviews
Why did you pick this product vs others?:
Goods reviews, but unfortunately,  it was as reported.","Revisado en los Estados Unidos el 7 de julio de 2025","Don't waste your money!","2.0 de 5 estrellas","","0",
"R1WARDJEI5ZG6G","Cary Enriquez","En mi opinión el mejor","Revisado en los Estados Unidos el 2 de julio de 2025","Higiene","5.0 de 5 estrellas","","0",
"R134NEE9ZNUWVE","robin","My cat loves it and so do I.","Revisado en los Estados Unidos el 1 de julio de 2025","No dust...clumps great.","5.0 de 5 estrellas","","0",
"R14RJ9XWS9TK5U","Amazon Customer","Seems too sandy. Hard to scoop","Revisado en los Estados Unidos el 30 de junio de 2025","Sandy","2.0 de 5 estrellas","","0",